Id,JobId,Title,Employer,Source,Description,Location,Industry,ExpiryDate,ScrappedDate
0,148217,DBA IMS/DB2 Z/OS(M/F),12.10.2023 | AFRICASHORE,https://www.ghanajob.com/job-vacancies-ghana/dba-imsdb2-zosmf-148217,"We are looking for DBA IMS/DB2 Z/OS (M/F) profiles / CVs to pass on to our clients for their future recruitment campaigns.
		&nbsp;...",Region of : Ashanti - Brong Ahafo - Central - Eastern - Greater Accra -...,,,12/13/2023 00:00:00
0,148218,Z/OS System Engineer Senior Storage(M/F),12.10.2023 | AFRICASHORE,https://www.ghanajob.com/job-vacancies-ghana/zos-system-engineer-senior-storagemf-148218,We are looking for Z/OS System Engineer Senior Storage (M/F) profiles / CVs to pass on to our clients for their future recruitment...,Region of : Ashanti - Brong Ahafo - Central - Eastern - Greater Accra -...,,,12/13/2023 00:00:00
Id,JobId,Title,Employer,Source,Description,Location,Industry,ExpiryDate,ScrappedDate
0,148219,Middleware System Engineer Z/OS (M/F),12.10.2023 | AFRICASHORE,https://www.ghanajob.com/job-vacancies-ghana/middleware-system-engineer-zos-mf-148219,We are looking for Middleware System Engineer Z/OS (M/F) profiles / CVs to pass on to our clients for their future recruitment campaigns...,Region of : Ashanti - Brong Ahafo - Central - Eastern - Greater Accra -...,,,12/13/2023 00:00:00
